,Company,Valuation ($B),Date Joined,Country,City,Industry,Select Investors
661,Standard Cognition,$1,2/17/2021,United States,San Francisco,Artificial intelligence,CRV Y Combinator Initialized Capital
662,Sentry,$1,2/18/2021,United States,San Francisco,Other,New Enterprise Associates Accel Bond
663,WeBull,$1,2/18/2021,China,Changsha,Fintech,Bojiang Capital Hongdao Capital Mobai Capital
664,Newsela,$1,2/25/2021,United States,New York,Internet software & services,Owl Ventures Technology Crossover Ventures Tao Capital Partners
665,Infra.Market,$1,2/25/2021,India,Thane,E-commerce & direct-to-consumer,Accel Tiger Global Management Nexus Venture Partners
666,Skydio,$1,2/25/2021,United States,Redwood City,Supply chain logistics & delivery,Andreessen Horowitz Andreessen Horowitz Institutional Venture Partners Accel
667,Vestiaire Collective,$1,3/1/2021,France,Paris,E-commerce & direct-to-consumer,Eurazeo IDInvest Partners Balderton Capital
668,Papaya Global,$1,3/4/2021,United States,New York,Internet software & services,Bessemer Venture Partners Insight Partners New Era Ventures
669,Flutterwave,$1,3/9/2021,United States,San Francisco,Fintech,Green Visor Capital CRE Venture Capital Greycroft
670,Aqua Security,$1,3/10/2021,Israel,Ramat Gan,Cybersecurity,TLV Partners Lightspeed Venture Partners M12
671,PatSnap,$1,3/16/2021,Singapore,,Internet software & services,Sequoia Capital China Shunwei Capital Partners Qualgro
672,Side,$1,3/22/2021,United States,San Francisco,Internet software & services,Coatue Managemeny Trinity Ventures Matrix Partners
673,Evidation Health,$1,3/22/2021,United States,San Mateo,Health,B Capital Group GE Ventures McKesson Ventures
674,Lattice,$1,3/23/2021,United States,San Francisco,Internet software & services,Khosla Ventures Thrive Capital Y Combinator
675,Feedzai,$1,3/24/2021,United States,San Mateo,Artificial intelligence,Global Founders Capital Shea Ventures Greycroft
676,Hopper,$1,3/24/2021,Canada,Montreal,Travel,Capital One Growth Ventures Citi Ventures OMERS Ventures
677,Pacaso,$1,3/24/2021,United States,Cincinnati,Fintech,Global Founders Capital Shea Ventures Greycroft
678,Gorillas,$1,3/25/2021,Germany,Berlin,E-commerce & direct-to-consumer,Coatue Management Atlantic Food Labs DST Global
679,Yunxuetang,$1,3/29/2021,China,Suzhou,Edtech,Matrix Partners China Sequoia Capital China Hundreds Capital
680,Cameo,$1,3/30/2021,United States,Chicago,Internet software & services,Lightspeed Venture Partners Kleiner Perkins Caufield & Byers Origin Ventures
681,Fetch Rewards,$1,3/31/2021,United States,Madison,E-commerce & direct-to-consumer,Greycroft Loeb.NYC DST Global
682,Groww,$1,4/7/2021,India,Bengaluru,Fintech,Tiger Global Management Sequoia Capital India Ribbit Capital
683,The Zebra,$1,4/12/2021,United States,Austin,E-commerce & direct-to-consumer,Silverton Partners Accel Ballast Point Ventures
684,Groq,$1,4/14/2021,United States,Mountain View,Artificial intelligence,TDK Ventures Social Capital D1 Capital Partners
685,Clearcover,$1,4/13/2021,United States,Chicago,Fintech,American Family Ventures Cox Enterprises OMERS Ventures
686,Injective Protocol,$1,4/20/2021,United States,New York,Fintech,Pantera Capital Cadenza Ventures BlockTower Capital
687,Sift,$1,4/22/2021,United States,San Francisco,Artificial intelligence,Union Square Ventures Insight Partners Spark Capital
688,SaltPay,$1,4/23/2021,United Kingdom,London,Fintech,Tiger Global Management Hedosophia
689,Capsule,$1,4/28/2021,United States,New York,Health,Thrive Capital Durable Capital Partners G Squared
690,MOLOCO,$1,4/29/2021,United States,Redwood City,Artificial intelligence,Smilegate Investment DSC Investments KTB Ventures
691,Mux,$1,4/30/2021,United States,San Francisco,Internet software & services,Accel Cobalt Capital Andreessen Horowitz
692,Firefly Aerospace,$1,5/4/2021,United States,Cedar Park,Other,XBTO Ventures Raven One Ventures SK Ventures
693,HoneyBook,$1,5/4/2021,United States,San Francisco,Internet software & services,Norwest Venture Partners Hillsven Capital Aleph
694,TensTorrent,$1,5/5/2021,Canada,Toronto,Artificial intelligence,Eclipse Ventures Fidelity Investments Moore Capital Management
695,Shift Technology,$1,5/6/2021,France,Paris,Artificial intelligence,Griffin Gaming Partners Andreessen Horowitz Battery Ventures
696,Forte Labs,$1,5/12/2021,United States,San Francisco,Fintech,Iris Capital Accel Elaia Partners
697,Axtria,$1,5/13/2021,United States,Berkeley Height,Data management & analytics,Helion Venture Partners Bain Capital Tech Opportunities Sequoia Capital India
698,Amount,$1,5/17/2021,United States,Chicago,Fintech,Invus Group Hanaco Venture Capital WestCap Group
699,Moglix,$1,5/17/2021,Singapore,,E-commerce & direct-to-consumer,Jungle Ventures Accel Venture Highway
700,Vise,$1,5/18/2021,United States,New York,Fintech,Sequoia Capital Founders Fund Bling Capital
701,Printful,$1,5/24/2021,United States,Charlotte,Other,Bregal Sagemount
702,Flash Express,$1,2/1/2021,Thailand,Bangkok,Supply chain logistics & delivery,SCB 10X Krungsri Finnovate eWTP Capital
703,Shippo,$1,6/2/2021,United States,San Francisco,Supply chain logistics & delivery,Version One Ventures Uncork Capital Bessemer Venture Partners
704,Thirty Madison,$1,6/2/2021,United States,New York,Health,Northzone Ventures Maveron Johnson & Johnson Innovation
705,LetsGetChecked,$1,6/7/2021,Ireland,Dublin,Health,Optum Ventures Qiming Venture Partners Transformation Capital
706,VerbIT,$1,6/8/2021,Israel,Tel Aviv,Artificial intelligence,ClalTech Vertex Ventures Oryzn Capital
707,Aura,$1,6/9/2021,United States,Burlington,Cybersecurity ,Warburg Pincus General Catalyst
